{
  "$schema": "https://json-schema.org/draft/2020-12/schema",
  "$id": "benchmarks/census/schemas/subcircuits.schema.json",
  "title": "Census subcircuit templates (typed parameters) with the subcircuits (fully bound templates) under each; never units",
  "type": "array",
  "items": {
    "type": "object",
    "additionalProperties": false,
    "required": [
      "id",
      "name",
      "description",
      "parameters",
      "accumulate",
      "reference_batch",
      "ir_definitions",
      "sources",
      "work_model",
      "subcircuits"
    ],
    "properties": {
      "id": {
        "type": "string",
        "pattern": "^[a-z0-9]+(-[a-z0-9]+)*$"
      },
      "name": {
        "type": "string",
        "minLength": 1
      },
      "description": {
        "type": "string",
        "minLength": 1
      },
      "parameters": {
        "type": "object",
        "minProperties": 1,
        "additionalProperties": {
          "type": "object",
          "required": [
            "type",
            "description"
          ],
          "properties": {
            "type": {
              "enum": [
                "integer",
                "string",
                "number"
              ]
            },
            "description": {
              "type": "string",
              "minLength": 1
            }
          },
          "additionalProperties": false
        }
      },
      "accumulate": {
        "type": [
          "string",
          "null"
        ],
        "enum": [
          "fp32",
          null
        ]
      },
      "reference_batch": {
        "type": [
          "integer",
          "null"
        ],
        "minimum": 1,
        "description": "the tables' reference batch, when the template is benchmarked"
      },
      "sources": {
        "type": "array",
        "minItems": 1,
        "items": {
          "type": "object",
          "additionalProperties": false,
          "required": [
            "label"
          ],
          "properties": {
            "label": {
              "type": "string",
              "minLength": 1
            },
            "href": {
              "type": "string",
              "format": "uri"
            }
          }
        }
      },
      "subcircuits": {
        "type": "array",
        "minItems": 0,
        "items": {
          "type": "object",
          "additionalProperties": false,
          "required": [
            "id",
            "display",
            "parameters",
            "fidelity_notes"
          ],
          "properties": {
            "id": {
              "type": "string",
              "pattern": "^[a-z0-9]+(-[a-z0-9]+)*/[a-z0-9][a-z0-9._-]*/[a-z0-9][a-z0-9._-]*$",
              "description": "<template>/<bound parameters>/<semantics>, e.g. gemm-coordinate/k1536/sm90-wgmma-e4m3, attention-head/d64-bn128/sm80-fa2-bf16, rmsnorm-fused-cuda/n2048-eps1e-05/bf16"
            },
            "display": {
              "type": "string",
              "minLength": 1
            },
            "parameters": {
              "type": "object",
              "minProperties": 1
            },
            "legacy_target": {
              "type": "string",
              "minLength": 1,
              "description": "the verity.ml.circuits.targets.target name it was known by"
            },
            "stood_for_by": {
              "type": "object",
              "description": "another subcircuit whose results and input set stand for this one (a recorded equivalence, not duplicated cells)",
              "additionalProperties": false,
              "required": [
                "subcircuit",
                "covers",
                "why",
                "ruling",
                "sources"
              ],
              "properties": {
                "subcircuit": {
                  "type": "string",
                  "pattern": "^[a-z0-9]+(-[a-z0-9]+)*/k[0-9]+/[a-z0-9]+(-[a-z0-9]+)*$"
                },
                "covers": {
                  "type": "string",
                  "minLength": 1
                },
                "why": {
                  "type": "string",
                  "minLength": 1
                },
                "ruling": {
                  "type": "string",
                  "minLength": 1
                },
                "sources": {
                  "type": "array",
                  "minItems": 1,
                  "items": {
                    "type": "object",
                    "additionalProperties": false,
                    "required": [
                      "label"
                    ],
                    "properties": {
                      "label": {
                        "type": "string",
                        "minLength": 1
                      },
                      "href": {
                        "type": "string",
                        "format": "uri"
                      }
                    }
                  }
                }
              }
            },
            "variable_ranges": {
              "type": "object",
              "description": "the range a per-input variable (the template's work_model.variables) takes over the workloads the subcircuit serves",
              "additionalProperties": {
                "type": "object",
                "additionalProperties": false,
                "required": ["min", "max", "source"],
                "properties": {
                  "min": {"type": "integer"},
                  "max": {"type": "integer"},
                  "source": {"type": "string", "minLength": 1}
                }
              }
            },
            "fidelity_notes": {
              "type": "array",
              "description": "known gaps between the subcircuit and what production runs",
              "items": {
                "type": "object",
                "additionalProperties": false,
                "required": [
                  "note",
                  "sources"
                ],
                "properties": {
                  "note": {
                    "type": "string",
                    "minLength": 1
                  },
                  "sources": {
                    "type": "array",
                    "minItems": 1,
                    "items": {
                      "type": "object",
                      "additionalProperties": false,
                      "required": [
                        "label"
                      ],
                      "properties": {
                        "label": {
                          "type": "string",
                          "minLength": 1
                        },
                        "href": {
                          "type": "string",
                          "format": "uri"
                        }
                      }
                    }
                  }
                }
              }
            },
            "sources": {
              "type": "array",
              "minItems": 1,
              "items": {
                "type": "object",
                "additionalProperties": false,
                "required": [
                  "label"
                ],
                "properties": {
                  "label": {
                    "type": "string",
                    "minLength": 1
                  },
                  "href": {
                    "type": "string",
                    "format": "uri"
                  }
                }
              }
            }
          }
        }
      },
      "verifier_evaluated": {
        "type": "object",
        "description": "parts of the template a proof backend leaves to the verifier's native evaluation (not proven): what, how much of the template, whether the headline counts a cell as covering it (with a footnote) and on whose ruling; views --preview-count-omitted counts those not counted",
        "additionalProperties": false,
        "required": ["parts", "share", "counted", "ruling", "sources"],
        "properties": {
          "parts": {"type": "string", "minLength": 1},
          "share": {"type": "string", "minLength": 1},
          "counted": {"type": "boolean"},
          "ruling": {"type": "string", "minLength": 1},
          "sources": {
            "type": "array",
            "minItems": 1,
            "items": {
              "type": "object",
              "additionalProperties": false,
              "required": ["label"],
              "properties": {"label": {"type": "string", "minLength": 1}, "href": {"type": "string", "format": "uri"}}
            }
          }
        }
      },
      "commitment_opening": {
        "type": "object",
        "description": "the template is a commitment opening, not arithmetic a proof backend proves: no backend cell covers it, and the headline lists it uncovered with this reason",
        "additionalProperties": false,
        "required": ["note", "sources"],
        "properties": {
          "note": {"type": "string", "minLength": 1},
          "sources": {
            "type": "array",
            "minItems": 1,
            "items": {
              "type": "object",
              "additionalProperties": false,
              "required": ["label"],
              "properties": {"label": {"type": "string", "minLength": 1}, "href": {"type": "string", "format": "uri"}}
            }
          }
        }
      },
      "ir_definitions": {
        "type": "array",
        "minItems": 1,
        "items": {
          "type": "string",
          "minLength": 1
        },
        "description": "the IR Definitions the template is bound to"
      },
      "work_model": {
        "type": "object",
        "additionalProperties": false,
        "required": [
          "version",
          "ops_per_input",
          "special_per_input",
          "basis",
          "variables",
          "source"
        ],
        "description": "arithmetic operations per input (one subcircuit instance) as a function of the bound parameters; an FMA counts as 2 ops, special functions apart",
        "properties": {
          "version": {
            "type": "string",
            "pattern": "^work-model/v[0-9]+$",
            "description": "the work-model version the tables' native N uses"
          },
          "ops_per_input": {
            "type": "string",
            "pattern": "^[A-Za-z0-9_ +*/()-]+$",
            "description": "an integer expression over the parameters (and variables): + - * // and parentheses"
          },
          "special_per_input": {
            "type": "object",
            "additionalProperties": {
              "type": "string",
              "pattern": "^[A-Za-z0-9_ +*/()-]+$"
            },
            "description": "special-function calls per input (rsqrt, exp, log, ...)"
          },
          "basis": {
            "type": "string",
            "minLength": 1
          },
          "variables": {
            "type": "object",
            "additionalProperties": {
              "type": "string"
            },
            "description": "per-input quantities that are not parameters"
          },
          "source": {
            "type": "string",
            "minLength": 1,
            "description": "the IR definition or kernel the count is read from"
          },
          "bytes_per_input": {
            "type": "string",
            "pattern": "^[A-Za-z0-9_ +*/()-]+$",
            "description": "bytes read and written per input, an integer expression over the parameters (and variables; BITS is the bit width of the bound datatype): the memory-bandwidth work model"
          },
          "port_datatypes": {
            "type": "object",
            "description": "the datatype of each port the bytes count (benchmarks/census/datatypes.json ids, or f32 / i32 for kernel-internal words)",
            "additionalProperties": {"type": "string", "minLength": 1}
          },
          "variable_bounds": {
            "type": "object",
            "description": "for a variable that varies per input, its bounds from the parameters of the verification unit it serves in: the VU parameter named by `by` selects a case, whose min and max are integer expressions over the VU parameters",
            "additionalProperties": {
              "type": "object",
              "additionalProperties": false,
              "required": ["by", "cases", "source"],
              "properties": {
                "by": {"type": "string"},
                "cases": {
                  "type": "object",
                  "minProperties": 1,
                  "additionalProperties": {
                    "type": "object",
                    "additionalProperties": false,
                    "required": ["min", "max"],
                    "properties": {
                      "min": {"type": "string", "pattern": "^[A-Za-z0-9_ +*/()-]+$"},
                      "max": {"type": "string", "pattern": "^[A-Za-z0-9_ +*/()-]+$"}
                    }
                  }
                },
                "source": {"type": "string", "minLength": 1}
              }
            }
          },
          "bytes_basis": {
            "type": "string",
            "minLength": 1
          },
          "bytes_per_input_cached": {
            "type": "string",
            "pattern": "^[A-Za-z0-9_ +*/()-]+$",
            "description": "bytes per input with per-row weights and tables served from cache (activations only): a preview basis"
          },
          "bytes_cached_basis": {
            "type": "string",
            "minLength": 1
          },
          "bytes_source": {
            "type": "string",
            "minLength": 1
          }
        }
      }
    }
  }
}
