[
  {
    "id": "gemm-coordinate",
    "name": "GemmCoordinate<K>",
    "description": "a chain of K multiply-accumulates from c_0 = 0 on one tensor-core instruction's exact semantics (FP32 accumulation), then that target's epilogue",
    "parameters": {
      "K": {
        "type": "integer",
        "description": "multiply-accumulates in the chain"
      },
      "datatype": {
        "type": "string",
        "description": "the operand datatype (census/datatypes.json)"
      },
      "semantics": {
        "type": "string",
        "description": "the exact tensor-core instruction whose accumulator step the chain uses (verity.ml.tc.instructions)"
      }
    },
    "accumulate": "fp32",
    "reference_batch": 4096,
    "ir_definitions": [
      "GemmCoordinate_v2{K, DOT} (verity.ml.gemm); vLLM Gemm_v1 (N per token row, Ampere mma) and Gemm_v2 (Hopper wgmma) are N of them"
    ],
    "sources": [
      {
        "label": "verity.proofs.target (GemmCoordinate<K>); backends/AGENTS.md: the decision workload, B = 4096 K = 1536 (frozen 2026-09-22)"
      }
    ],
    "work_model": {
      "version": "work-model/v0",
      "ops_per_input": "2*K",
      "special_per_input": {},
      "basis": "K multiply-accumulates (an FMA is 2 ops); the bf16 epilogue conversion is not counted (views.native, the tables' N)",
      "variables": {},
      "source": "verity.ml.gemm GemmCoordinate: K/16 tensor-core steps of 16 multiply-adds",
      "bytes_per_input": "K*BITS//8",
      "bytes_basis": "reads the coordinate's weight row w[K] at the operand datatype's width (BITS, census/datatypes.json); x[K] is shared by every coordinate of its row and y is one word, so neither is counted per coordinate (the batch-1 decode reading: GEMM streams its weights)",
      "bytes_source": "bench-spine's port definitions (verity_numerical.bench.templates): gemm-coordinate x[K], w[K] -> y"
    },
    "subcircuits": [
      {
        "id": "gemm-coordinate/k1536/sm80-mma-bf16",
        "display": "GemmCoordinate<1536> · sm80 mma · BF16",
        "parameters": {
          "K": 1536,
          "datatype": "bf16",
          "semantics": "sm80.mma.m16n8k16.bf16"
        },
        "fidelity_notes": [],
        "legacy_target": "first-campaign-target/2026-09-21"
      },
      {
        "id": "gemm-coordinate/k1536/sm90-mma-bf16",
        "display": "GemmCoordinate<1536> · sm90 mma · BF16",
        "parameters": {
          "K": 1536,
          "datatype": "bf16",
          "semantics": "sm90.mma.m16n8k16.bf16"
        },
        "fidelity_notes": [
          {
            "note": "H100 BF16 models mma (sm90.mma.m16n8k16.bf16); vLLM's H100 BF16 GEMMs run wgmma (sm90.wgmma.m64n8k16.bf16). On the H100 the two write the same words on every captured input, NaN and infinities included, so the gap is in the name only; gemm-coordinate/k1536/sm90-wgmma-bf16 names the instruction production runs",
            "sources": [
              {
                "label": "docs ontology, Presentation rules (fidelity notes); verity.proofs.target BF16_HOPPER"
              },
              {
                "label": "lane wgmma-bf16 H100 runs r20260926-020157-242a / r20260926-020210-aee8 (wgmma, A from shared memory / registers) and r20260926-023321-ecb5 (mma.sync, a second H100): every word matches hopper_bf16_wgmma_k16's total step, 0 mismatches; the specials family identical word for word across the instructions; veritor's wgmma records replayed through mma.sync, 0 mismatches (packages/verity/tests/ml/test_wgmma_bf16.py)"
              }
            ]
          }
        ],
        "legacy_target": "bf16-hopper-mma-draft/2026-09-22"
      },
      {
        "id": "gemm-coordinate/k1536/sm90-wgmma-bf16",
        "display": "GemmCoordinate<1536> · sm90 wgmma · BF16",
        "parameters": {
          "K": 1536,
          "datatype": "bf16",
          "semantics": "sm90.wgmma.m64n8k16.bf16"
        },
        "fidelity_notes": [],
        "stood_for_by": {
          "subcircuit": "gemm-coordinate/k1536/sm90-mma-bf16",
          "covers": "its results (the H100 BF16 cells) and its input set, bench-instances-bf16-hopper-v1",
          "why": "on the H100, wgmma BF16 writes exactly mma BF16's output words on every captured input, NaN and infinities included",
          "ruling": "root, 2026-09-26 02:44Z: record the equivalence rather than duplicate cells; new real-K H100 BF16 cells use this subcircuit's id",
          "sources": [
            {
              "label": "lane wgmma-bf16 H100 runs r20260926-020157-242a (art:8f903385, wgmma, A from shared memory) and r20260926-020210-aee8 (art:f9508ae8, wgmma, A from registers) on one H100; r20260926-023321-ecb5 (art:4ece89a0, mma.sync, a second H100): 25,833,472 swept elements incl. 6,144 specials, 0 mismatches against hopper_bf16_wgmma_k16's total step; veritor's 44,046 wgmma records replayed through mma.sync, 0 mismatches (PR #49, packages/verity/tests/ml/test_wgmma_bf16.py)"
            }
          ]
        }
      },
      {
        "id": "gemm-coordinate/k1536/sm90-wgmma-e4m3",
        "display": "GemmCoordinate<1536> · sm90 wgmma · FP8 (E4M3)",
        "parameters": {
          "K": 1536,
          "datatype": "e4m3",
          "semantics": "sm90.wgmma.m64n8k32.e4m3"
        },
        "fidelity_notes": [],
        "legacy_target": "fp8-hopper-wgmma-draft/2026-09-22"
      },
      {
        "id": "gemm-coordinate/k1536/sm89-mma-e4m3",
        "display": "GemmCoordinate<1536> · sm89 mma · FP8 (E4M3)",
        "parameters": {
          "K": 1536,
          "datatype": "e4m3",
          "semantics": "sm89.mma.m16n8k32.e4m3"
        },
        "fidelity_notes": [],
        "legacy_target": "fp8-ada-mma-draft/2026-09-22"
      },
      {
        "id": "gemm-coordinate/k1536/sm120-mma-e2m1-nvf4",
        "display": "GemmCoordinate<1536> · sm120 mma · FP4 (NVFP4, E2M1)",
        "parameters": {
          "K": 1536,
          "datatype": "e2m1",
          "semantics": "sm120.mma.m16n8k64.e2m1.nvf4"
        },
        "fidelity_notes": [],
        "legacy_target": "nvfp4-sm120-mma-draft/2026-09-22"
      },
      {
        "id": "gemm-coordinate/k2048/sm80-mma-bf16",
        "display": "GemmCoordinate<2048> · sm80 mma · BF16",
        "parameters": {
          "K": 2048,
          "datatype": "bf16",
          "semantics": "sm80.mma.m16n8k16.bf16"
        },
        "fidelity_notes": [],
        "sources": [
          {
            "label": "vLLM's reduction lengths (census/workloads.json: Llama-3.2-1B's Gemm_v1 K = 2048 and 8192); the real-K cells on it (flock-backend 2026-09-26 04:52Z and 06:05Z, bligero-real-k), keyed by statement (docs ontology, 'A result')"
          }
        ]
      },
      {
        "id": "gemm-coordinate/k2048/sm90-wgmma-bf16",
        "display": "GemmCoordinate<2048> · sm90 wgmma · BF16",
        "parameters": {
          "K": 2048,
          "datatype": "bf16",
          "semantics": "sm90.wgmma.m64n8k16.bf16"
        },
        "fidelity_notes": [],
        "sources": [
          {
            "label": "vLLM's reduction lengths (census/workloads.json: Llama-3.2-1B's Gemm_v1 K = 2048 and 8192); the real-K cells on it (flock-backend 2026-09-26 04:52Z and 06:05Z, bligero-real-k), keyed by statement (docs ontology, 'A result')"
          }
        ]
      },
      {
        "id": "gemm-coordinate/k2048/sm89-mma-e4m3",
        "display": "GemmCoordinate<2048> · sm89 mma · FP8 (E4M3)",
        "parameters": {
          "K": 2048,
          "datatype": "e4m3",
          "semantics": "sm89.mma.m16n8k32.e4m3"
        },
        "fidelity_notes": [],
        "sources": [
          {
            "label": "vLLM's reduction lengths (census/workloads.json: Llama-3.2-1B's Gemm_v1 K = 2048 and 8192); the real-K cells on it (flock-backend 2026-09-26 04:52Z and 06:05Z, bligero-real-k), keyed by statement (docs ontology, 'A result')"
          }
        ]
      },
      {
        "id": "gemm-coordinate/k2048/sm90-wgmma-e4m3",
        "display": "GemmCoordinate<2048> · sm90 wgmma · FP8 (E4M3)",
        "parameters": {
          "K": 2048,
          "datatype": "e4m3",
          "semantics": "sm90.wgmma.m64n8k32.e4m3"
        },
        "fidelity_notes": [],
        "sources": [
          {
            "label": "vLLM's reduction lengths (census/workloads.json: Llama-3.2-1B's Gemm_v1 K = 2048 and 8192); the real-K cells on it (flock-backend 2026-09-26 04:52Z and 06:05Z, bligero-real-k), keyed by statement (docs ontology, 'A result')"
          }
        ]
      },
      {
        "id": "gemm-coordinate/k8192/sm80-mma-bf16",
        "display": "GemmCoordinate<8192> · sm80 mma · BF16",
        "parameters": {
          "K": 8192,
          "datatype": "bf16",
          "semantics": "sm80.mma.m16n8k16.bf16"
        },
        "fidelity_notes": [],
        "sources": [
          {
            "label": "vLLM's reduction lengths (census/workloads.json: Llama-3.2-1B's Gemm_v1 K = 2048 and 8192); the real-K cells on it (flock-backend 2026-09-26 04:52Z and 06:05Z, bligero-real-k), keyed by statement (docs ontology, 'A result')"
          }
        ]
      },
      {
        "id": "gemm-coordinate/k8192/sm90-wgmma-bf16",
        "display": "GemmCoordinate<8192> · sm90 wgmma · BF16",
        "parameters": {
          "K": 8192,
          "datatype": "bf16",
          "semantics": "sm90.wgmma.m64n8k16.bf16"
        },
        "fidelity_notes": [],
        "sources": [
          {
            "label": "vLLM's reduction lengths (census/workloads.json: Llama-3.2-1B's Gemm_v1 K = 2048 and 8192); the real-K cells on it (flock-backend 2026-09-26 04:52Z and 06:05Z, bligero-real-k), keyed by statement (docs ontology, 'A result')"
          }
        ]
      },
      {
        "id": "gemm-coordinate/k8192/sm89-mma-e4m3",
        "display": "GemmCoordinate<8192> · sm89 mma · FP8 (E4M3)",
        "parameters": {
          "K": 8192,
          "datatype": "e4m3",
          "semantics": "sm89.mma.m16n8k32.e4m3"
        },